path,knowledge,similarQuestion,Answer
Student/CCO,成绩单可以改吗,"成绩单是不是可以更改？
成绩单能修改吗？",不可以，且没有商量和谈判的余地。<br/><br/>首先，梅沙书院的成绩单代表了梅沙书院作为一个向全世界输送优质学生的学校，需要对自己的学生品质负责。<br/>其次，修改成绩单违背了一些最基本的原则：公平和诚信。如果信息可以隐瞒，那么可以被隐瞒的就不应该只是那些看上去不好的信息，好的信息也应当一起被隐瞒。<br/><br/>对梅沙书院来说，公平和诚信是立命之本。我们建立了严苛的学术标准，建立了良好了社会和国际声誉，成绩单的分量就会越重，这带来的最直接的益处就是：学校知道了VMA的可靠，也就更愿意相信梅沙书院的学生。这就给了咱们学校的学生一些竞争优势，这积累下来的口碑可以让我们的学生带着更有公信力的成绩――甚至可能是更容易地――进入知名学校。
Student/CCO,成绩单上有什么信息,成绩单上都会有什么信息？,成绩单上会有该学生修过的所有课程，课程等级难度，以及这些课程的最终分数。分数以学期为单位，呈现在成绩单上；<br/>成绩单上也会按照学期到学年的顺序，汇总展示三年的成绩；<br/>成绩单上会有两个分数，加权成绩和未加权成绩。<br/>成绩单上会解释各个成绩等级所对应的具体分数；如A+对应4.3，A对应4，A-对应3.7
Student/CCO,成绩单申请,"如何申请梅沙书院的成绩单？
梅沙书院成绩单申请政策？",只有学生本人或者学生的法定监护人可以申请开具该生的成绩单。学生的信息和成绩记录不允许进行任何省略和更改。为保障万科梅沙书院成绩单的诚信度和对所有学生的公平性，学校各部门都会严格执行这项政策。<br/><br/>为了使成绩单的申请更加便捷，即日起学生可以直接在我校的即时通讯系统“钉钉”上申请成绩单。成绩单包括如下种类：官方成绩单、转学/夏校成绩单、签证成绩单、非官方成绩单、当前学期期中报告。其中，只有非官方成绩单和签证成绩单可以交给学生或学生的法定监护人，其它种类的成绩单都是由升学咨询直接发送给大学、或其他高中。<br/><br/>请注意：成绩单的开具需要5个工作日。周末、寒暑假及学校节假日均无法受理成绩单申请。请同学们一定计算好申请截止日期提前申请成绩单。如果需要邮寄成绩单，请额外预留3个工作日的邮寄时间。<br/><br/>成绩单的申请只需三步：<br/>1、 学生打开钉钉的“审批”功能<br/>2、 找到“学生成绩单申请”<br/>3、填好并且提交给自己的升学咨询老师，即完成了成绩单申请<br/><br/>如果需要邮寄成绩单，请联系自己的升学咨询老师交快递费。目前DHL快递定价为北美地区197元，澳大利亚是182，欧洲地区208，日本116元。一般可在3个工作日之内寄到。<br/><br/><br/>如有任何问题请至511升学咨询办公室咨询。
Student/CCO,需要初中成绩单吗？,"申请的时候要提交初中的成绩单吗？
要多少份？
开初中成绩单是否有流程？
初中成绩单有什么要求？",申请时学生需要提供初三（九年级）成绩单。以下为开具过往成绩单的要求：<br/>1. 成绩单上须显示学生的姓名、出生日期、在原学校的在读时间（何年何月至何年何月）。<br/>2. 成绩单上须至少显示学生9年级上、下两学期的在校成绩（非中考分数）。<br/>3. 成绩单的备注中须注明所学科目的满分分数。<br/>4. 成绩单抬头处须显示学校全称，落款处须显示原学校的学校全称、地址、电话及成绩单打印日期。并加盖原学校的公章或教务章。<br/>5. 成绩单上所有信息须以中英文显示。如原学校无法提供中英文成绩单，请发电子邮件至升学咨询老师邮箱寻求帮助。<br/>6. 须至少开出两份（建议五到十份）成绩单。将成绩单封在原学校的官方信封中，并在信封两端封口处盖章。如原学校无官方信封，则使用普通信封也可。
Student/CCO,升学咨询办公室职能,"升学咨询办公室的主要职能是什么？
升学咨询有什么用？
升学咨询办公室作用？",升学咨询办公室的主要职能是帮助学生在升学和申请的道路上助一臂之力的非学术部门。它的职能有专业的一面，但也有综合的一面，总的说来，升学咨询办公室的职能主要包括<br/><br/>1. 跟学生建立紧密的联系，了解学生的总体学习状况、学术优劣势、活动表现等等；这样做的目的是为了能够在学生需要的时候，根据他们的具体情况，给出大体方向上的建议――应该选择什么样的课程、什么样的活动――以保证在最后一役时，学生的申请能体现出内在的逻辑一致，增加录取几率；<br/><br/>2. 跟家长保持联络，让家长多了解跟升学相关的、来源可靠的、专业准确的信息，从家长这方面，引导他们为申请做好准备。家长时常为孩子升学的焦虑所困扰，且容易互相传播焦虑情绪和不一定准确的信息，当这种情况出现，家长们会有成倍的焦虑，而且会把这种心理状态传递给孩子，增加孩子的心理负担。升学咨询办公室有专业且经验丰富的升学咨询老师，是为家长们答疑解惑、缓解焦虑的地方。<br/><br/>3. 基于对学生具体情况的掌握，在申请时写出对申请有积极影响的推荐信。<br/><br/>4. 在申请前期，培训学科组老师撰写推荐信。<br/><br/>5. 从高一开始，通过“升学咨询课”，辅导学生了解跟升学相关的重要信息，培养学生自我认知的意识、反思生活经验的习惯、搜索与专业、学校和职业相关的信息的能力。同时，课程还会涵盖申请过程中申请平台的填写和使用、如何撰写文书，以及面试培训等等的内容。通过长期的信息层面和能力层面的覆盖，帮助学生在高中前两年就开始积累关键信息，供申请时使用。从这方面来说，升学咨询办公室的参与贯穿了申请前、中、后的各个阶段，因此家长也不必要再从校外寻找第三方机构包办申请。<br/><br/>6. 跟外教联合运作“写作中心”，帮助学生提升文书的语言质量，保证申请文书中试图表达的信息能够跨越文化障碍，被充分传递。<br/><br/>7. 跟世界各地的大学保持联系，参加跟招生和升学相关的会议、接待来访的招生官，以及承办跟招生和升学相关的活动。通过这一系列的活动以及跟招生官的互动，升学咨询办公室可以获得许多有价值的新信息，如招生倾向或新趋势等――而这些信息往往还没有被发布出来。<br/><br/>8. 筛选市面上有价值的、含金量高的活动，推荐给有需要的学生参加，帮助这些学生更好地开发和证明自己的潜能，增加自己被名校青睐的几率。<br/><br/>9. 申请时为学生邮寄官方成绩单。<br/>10. 组织跟升学和申请相关的家长讲座或论坛，集中答疑。<br/><br/>11. 针对学生和家长的疑惑和认知盲区，定期举办有关标准化考试（托福和SAT）的知识讲座，尽量让大家在准备考试或选择机构时少走弯路，把钱用在刀刃上，提高备考效率。
Student/CCO,梅沙书院的升学咨询办公室有什么不同之处,"梅沙书院的升学咨询办公室跟其它学校比有什么不同之处？
梅沙书院升学咨询的特别之处？",梅沙书院有全球规模最大的升学咨询办公室之一，一共有16人。在绝大多数学校，升学咨询和学生的配比会超过1:100，但梅沙书院的升学咨询办公室会把申请年级这个比例控制在1:20。而构建起这么大的升学咨询办公室，自然有更深层的原因。<br/><br/>实施学生为本的理念。梅沙书院试图通过打造一个高标准，有经验且专业的升学咨询团队，为刷新行业标准尽一份力。身为教育者的梅沙团队，深深知道师生配比太不均衡会给学生升学造成什么影响。学生需要关注，而只有一个有足够多人的升学咨询办公室，才能够做到关注每一个学生。<br/>对教育理想的践行。教育是一个缓慢优雅的过程，不是一蹴而就的短跑比赛，更不是不顾后果的揠苗助长。如果准备不踏实，过程不丰满，那些被亏欠的部分总会以这样或那样的形式在学生今后的学习和生活中找上门来。我们关注的是过程，对于结果的态度是期待与等待，因为我们相信，如果过程走得踏实，好的结果只是必然。造访过许多学校，也了解过许多申请机构，常出现的情况是当事人以申请到某个学校为目标，从而指导过程，这样的理念和行事哲学往往会忽略学生的热情和兴趣，伤害甚至抹杀学生作为“人”的需求。梅沙书院并不粗暴干涉学生的发展，相反，我们愿意用陪伴的心态去跟学生一同健康成长，引导学生发现兴趣、获得进步的内驱动力，从而引导学生做出最适合自己的选择。
Student/CCO,需不需要找中介,"需不需要去找外部的申请机构指导孩子的留学申请？
需要找中介吗？",1. 不可否认的一点是，在梅沙创校的阶段，梅沙书院的升学咨询办公室远不如现在壮大，在帮助学生的过程中有许多方面做得不够细致；在聘用升学咨询的时候，也并未考虑周全，使用了不懂中文的外籍人士。但现在这一问题已经解决：我们的升学咨询均从海内外顶尖院校毕业，外籍老师都具有双语能力――事实上，我们已经把双语能力，当成了招聘外籍人士的门槛。这14名升学咨询是办公室的全新动力――他们都有丰富的行业经验，可以从升学各个方面帮助学生。<br/><br/>2. 波纹效应。学生和家长在面对升学时，因为处在信息流的末端，在获得信息的时候往往不能及时分辨信息的真假与准确程度，这首先导致了非官方的，甚至是虚假信息的传播。这些信息被扩散的结果，就是那些附带在信息上的情绪也被发散了出去。人们往往会找所谓的“前辈”来“取经”，所以高二的家长会向询问高三的家长询问情况。考虑到年级跟年级之间的紧密联系，家长与家长之间的频繁沟通，有些因为上一年的问题而产生的态度和观念，就容易被传递给下一届家长。<br/><br/>3. 观念转变需要时间。在国内，找第三方机构帮助申请――不管是何种方式，但一条龙全包式服务占多数――早已成为大家习惯的事情。人是屈从习惯的，更有从众的心理：别人找，我不找，似乎有矮人一头或吃亏的心理暗示。毫不夸张地说，留学从开始显露出成为趋势的苗头的时候，找机构就成为了惯常做法。我们甚至会认为“一分钱一分货”，不要钱的辅导和咨询质量不高。可是事实是，咨询和辅导并不仅仅需要专业知识，在专业知识背后，最根本的，其实是对学生的关怀。升学咨询办公室的老师们都是一群热爱教育不吝惜对学生的关怀的年轻人，当然是打破惯常思维的鲜活例证。升学咨询办公室愿意用行动证明对学生的关注和在乎，用了解帮学生做出最适合自己的选择和决定，也帮助家长逐渐转变观念，让诸位意识到学校其实是可以信赖和依靠的。                                                    
Student/CCO,升学咨询课作用,升学咨询课是什么？有什么用？,升学咨询课的出现是必然，它是升学咨询办的老师们结合多年咨询经验和自己研修的升学咨询课设计出的一门课程。它的构建逻辑和目的，是从升学的前、中、后三个阶段，全面覆盖学生在升学和申请领域的认知和技能需求。课程的时间跨度也长达三年。<br/><br/>高一：带领学生从宏观上对升学和申请形成全面的了解，建立自我认知和剖析的意识，初步获得搜索信息，完成决策的能力。在这一年中，我们的课程主要涵盖以下几点：性格与职业倾向测试、课程设计、学术及课外活动介绍、参与原则与建议、个人档案建立和简历撰写、不同国家教育体系差别、专业类别介绍、如何了解一所学校、文书类别介绍、文书写作。每一个部分都会有相应的个人或小组作业，如果学生能完整跟下来，高一结束就会对申请这件事有大致了解。<br/><br/>高二：在高一全面了解申请的基础上，深入引导和辅导学生完成申请中最重要的准备工作，带领学生解决申请中会出现的操作问题，为高三申请打下基础。高二的课程内容包括性格和职业倾向倾向测试，了解学校及选校、申请平台介绍和填写、文书写作及修改<br/><br/>高三：带领学生处理Offer以后的信息和培训：如何社交、就医流程、烟酒大麻、性与性别、行前准备等等
Student/CCO,职业性格测试,你们的性格倾向测试是怎么回事？如果我小孩两次测出来结果不一样怎么办？,就在不久以前，国内都不太有“生涯规划”的概念。这一套新鲜的体系，目的就是为了让每个人在自我探索和职业发展的道路上少走弯路。而做出适合自己的选择，前提就是要了解自己――我是内向型人格还是外向型人格？我更喜欢处理事实信息还是从一堆信息中提取和抽象出规律？我是喜欢指定计划还是执行计划？我更喜欢遵守规则还是探索可能？我们对这些维度一定会有些感性认知，可是感觉在很多时候会骗人，如果我们带着不准确的认知做人生的决策，试错的成本很可能会很高。因此，在这样的背景之下，性格倾向测试就显得很有必要了――它能帮助我们建立对自己的更清晰的认知。<br/><br/>两次结果不同很正常，因为测试的过程会受到很多主观因素的影响，并不影响我们的规划。性格测试结果的改变可能影响以下几点：<br/>活动设计<br/>专业<br/>学校
Student/CCO,活动少影响申请结果吗,"我的孩子没有那么多活动，对申请有什么影响？
活动不够对申请有什么影响？
没那么多课外活动可以吗？
课外活动少影响申请吗?",大部分美国大学的录取采用holistic review，即综合评价的方式。评价内容包括学术成绩、英语能力、标化考试成绩、个人文书、教师推荐信、课外活动等方面。所以，活动固然重要，但只是申请材料的一部分。不同学校对于”活动“在申请中的比重不一样，不能一慨而论。
Student/CCO,要参加高大上的活动吗,我的孩子课外活动不出彩，怎么办？我一定要参加许多高大上的活动吗？,大学申请是一个全面评估的过程，课外活动只是评估中的一个方面。大学希望通过课外活动了解申请者的学术兴趣，个性特征以及综合能力等不同的方面，进而判断这个学生能为自己的学校带来什么，是不是自己学校所需要的学生。参与课外活动很重要的原则是学生真心喜欢，并且投入时间精力展现自己的热情，在持续参与的过程中获得成就或个人成长是大学希望看到的，而不是刻意去做市面上所谓的“高大上”的活动，
Student/CCO,招生官看活动,招生官在活动里寻找什么？, 学术兴趣、能力、天赋特长、个性特征、成熟度等
Student/CCO,领导力在活动中,"领导力在申请过程中是什么地位？
领导力重要吗？
必须有领导力吗？",领导力是很重要但有时它的重要性被过分强调了。大学的录取是非常多元的，学生也不是一个模式的。
Student/CCO,活动何时规划,"活动需要提前多久做规划呢？
活动什么时候开始做？
如何规划活动？",我们会指导学生在高一就开始进行课外活动相关的探索。
Student/CCO,竞赛与申请的关系,"竞赛中的奖项与大学申请的关系是怎样的？
竞赛在申请中重要吗？
申请看竞赛吗？",竞赛获奖是学生学术活动成果的体现，能体现出学生在某方面的突出能力，对于大学申请是有帮助的，但大学申请是一个综合评估的过程，学术活动表现只是考量的一个方面。
Student/CCO,高一要有方向吗,"一定要在高一有明确的方向吗？
什么时候要有明确的方向？",学生不一定要在高一就有明确的方向，高一是学生探索发现自我的阶段，学生可以对自己感兴趣的课程或课外活动进行尝试，通过尝试来发现自己真正感兴趣的方向。
Student/CCO,高二要有方向吗,高二了也没有明确的专业方向怎么办？,"事实上，到了高二也还没有明确方向的学生也有不少。家长可以通过孩子在高一阶段的学术成绩及做过的课外活动，跟他一起分析他的优势和强项。在此基础上，跟孩子一起探讨一些比较适合他的方向。如果家长对此了解不是很多或是不确定的情况下，可以求助孩子的升学咨询, 获得专业的指导和帮助。"
Student/CCO,没有专业方向是否影响申请,没有明确的专业方向，申请的时候会受到影响吗？,"没有明确的专业方向对学生的大学申请没有太大的影响，事实上，美国大学是允许学生不定专业来进行申请的，学生在申请的时候可以选择 ""Undecided"". 美国大学的大一和大二阶段还是以通识课程为主，绝大多数学校允许学生在大二的时候把专业方向定下来即，这就给了学生充分的时间来最终确定自己专业方向。"
Student/CCO,转专业容易吗,"美国大学好转专业吗？
美国大学转专业容易吗？
美国大学转专业难吗？",专业转换的难度主要还是取决于学生就读的学校。如果学生就读的是文理学院，转换专业非常方便，因为学生不会被分配到不同的学院中。但是不同的专业也会有不同的毕业要求。如果学生就读的是综合大学的话，视学校的情况而定。一般而言，学校大热的学院或学科都是比较难转的，其他相对会好一些。举例来说，华大西雅图的计算机专业还有纽大的Stern商学院都是非常难转进去的，但是乔治城的四个本科学院相互之间转换就很容易。涉及到具体学校的情况，建议跟之前已经就读该校的校友进行请教或跟Counselor进行讨论。
Student/CCO,备考托福,如何复习托福考试？,阅读<br/>一般来说，中国考生的特点是英语书面能力较强而实用能力偏弱，对应到托福中就是阅读和写作可能相对会考得更好一些而听力和口语有时候就不太理想了。当然这并非绝对，只是大方向上的表现特点。而假如你也是更擅长书面能力的考生，建议每天花在阅读备考上的时间就不应该太多了，假如1天有4个小时的备考时间，在阅读上大家其实用个45分钟-1小时来进行备考就足够了。另外托福阅读备考建议按照题型来进行而不是文章题材来进行，因为考试具体会出什么主题内容的文章你是无法确定的，但阅读题型一般都是比较固定的，按照题型备考效率会更高一些。<br/><br/>写作<br/>托福写作分为独立写作和综合写作，独立写作对大家单纯的写作功底要求更高，建议多花一些时间，每天至少保证一篇作文的完整练笔或是5-10个题目的提纲训练整理，并定期进行一些写作论据素材和好词好句的集中归纳和记忆。综合写作部分在小编看来与其说是考写作能力不如说是考听力和阅读的综合能力，不建议考生投入太多精力准备，把听力和阅读备考做到位综合写作的备考自然就做好了，每周稍微抽出一些时间来进行10题左右的实战演练也就足够了。作文部分每天的备考时间同样不要超过1小时。<br/><br/>口语<br/>如上文所说，大部分中国考生在托福口语上面的表现是相对较差一些的，因为口语不仅涉及到应用，更关键的是占据了主动两字。不同于听力只要被动接受见招拆招，口语可是要求大家自己开口来说的。这对于哑巴英语一路学上来的部分同学来说可谓千难万难。而在具体备考中，建议大家循序渐进，不要一上来就按照给出话题然后开说的方式来进行，最好按照先保证开口，然后少量练习熟悉表述方式，逐步过渡到能够实战的程度，这当中需要用到的各种方式比如发音纠正、跟读训练等等本文不详细展开，但建议大家每天投入的时间可以稍多一些，固定时间至少保证1小时，其它可以在碎片时间中进行的各种口语训练累积起来也要有至少半小时。<br/><br/>听力<br/>托福听力的训练其实是最为自由灵活的，大家既可以留出整段时间来进行比较集中的训练，也可以结合SSS60秒等较为简短的听力训练资料在每天的各类碎片时间中进行备考，当然如果是进行官方真题Official真题练习的话还是建议大家完整进行，这样更能起到实战模拟演练的作用。听力每天的备考时间建议无论是整段训练还是碎片分割式练习，累积时间达到1小时即可
